{
  "$schema": "https://json-schema.org/draft/2020-12/schema",
  "$id": "bobercad/app/schemas/rule-pack.schema.json",
  "title": "Rule Pack Schema",
  "description": "Validates reusable compliance rule-pack metadata. Rule functions live in library code and return diagnostics only.",
  "type": "object",
  "required": [
    "$schema",
    "id",
    "title",
    "jurisdiction",
    "applicableComponentKinds",
    "sourceReferences"
  ],
  "properties": {
    "$schema": {
      "type": "string",
      "minLength": 1
    },
    "id": {
      "type": "string",
      "minLength": 1
    },
    "title": {
      "type": "string",
      "minLength": 1
    },
    "jurisdiction": {
      "type": "string",
      "minLength": 1
    },
    "edition": {
      "type": "string",
      "minLength": 1
    },
    "applicableComponentKinds": {
      "type": "array",
      "minItems": 1,
      "uniqueItems": true,
      "items": {
        "type": "string",
        "minLength": 1
      }
    },
    "sourceReferences": {
      "type": "array",
      "minItems": 1,
      "items": {
        "type": "object",
        "required": [
          "title",
          "url"
        ],
        "properties": {
          "title": {
            "type": "string",
            "minLength": 1
          },
          "url": {
            "type": "string",
            "pattern": "^https?://"
          }
        },
        "additionalProperties": false
      }
    }
  },
  "additionalProperties": false
}
